{
  "version": "1.0",
  "timestamp": "2025-10-02T12:00:00Z",
  "commit_sha": "abc123def456abc123def456abc123def456abc1",
  "scan_type": "pr-gate",
  "rust_version": "1.92.0",
  "tools": {
    "cargo_audit": "0.21.2",
    "cargo_deny": "0.16.0",
    "cargo_geiger": "0.13.0"
  },
  "vulnerabilities": {
    "count": 0,
    "by_severity": {
      "critical": 0,
      "high": 0,
      "medium": 0,
      "low": 0
    },
    "advisories": []
  },
  "scan_duration_ms": 45000,
  "exit_status": "success",
  "workflow_run_id": "1234567890",
  "advisory_db_version": {
    "last_commit": "f71b77f025d1c2afcd2b07a32e7127a5d138ef4a",
    "last_updated": "2025-10-02T12:04:17Z",
    "advisory_count": 820
  },
  "unsafe_code_metrics": {
    "total_functions": 0,
    "total_expressions": 0,
    "crates": [
      {
        "name": "copybook-core",
        "unsafe_functions": 0,
        "unsafe_expressions": 0
      },
      {
        "name": "copybook-codec",
        "unsafe_functions": 0,
        "unsafe_expressions": 0
      },
      {
        "name": "copybook-cli",
        "unsafe_functions": 0,
        "unsafe_expressions": 0
      },
      {
        "name": "copybook-gen",
        "unsafe_functions": 0,
        "unsafe_expressions": 0
      },
      {
        "name": "copybook-bench",
        "unsafe_functions": 0,
        "unsafe_expressions": 0
      }
    ]
  },
  "compliance_metadata": {
    "sox_compliant": false,
    "hipaa_compliant": false,
    "pci_dss_compliant": false,
    "gdpr_compliant": false,
    "retention_days": 90,
    "audit_id": "copybook-rs-security-2025-10-02-abc123"
  }
}
